{
  "schema_version": "0.1",
  "status": "complete",
  "input": {
    "M01": {
      "path": "data\\acceptance\\frozen-20260910\\integration\\m01\\result.json",
      "sha256": "e236f49ff1c96489ae2973f31b88270953303bb9ed90182d90d97bbb724b3ac7",
      "length": 13907,
      "schema_version": "0.1",
      "status": "ok"
    },
    "M02": {
      "path": "reports\\acceptance\\2026-09-11-abc\\run\\m02\\features.json",
      "sha256": "6f7541d10152829fe8ebf63d4e284b19cf24874643d6253acc47279f1c848b99",
      "length": 80268,
      "schema_version": "0.1",
      "status": "ok"
    },
    "M03": {
      "path": "reports\\acceptance\\2026-09-11-abc\\run\\m03\\framing.json",
      "sha256": "9a88329ec8e91d857ba4fc299f4982fee31c76e1cf64373ab7cb7dafcdad618d",
      "length": 1377,
      "schema_version": "0.1",
      "status": "complete"
    },
    "M04": {
      "path": "reports\\acceptance\\2026-09-11-abc\\run\\m04\\clusters.json",
      "sha256": "dc2525e5904581d9357739d595b4d0163b8adc85048dd18e61d4e619532b5266",
      "length": 1296,
      "schema_version": "0.1",
      "status": "ok"
    },
    "M05": {
      "path": "reports\\acceptance\\2026-09-11-abc\\run\\m05\\alignments.json",
      "sha256": "d41459777f500843afeae6e509c3b7fcdc3666b5332f2b824d2046e5d8a587de",
      "length": 1371,
      "schema_version": "0.1",
      "status": "ok"
    },
    "M06": {
      "path": "reports\\acceptance\\2026-09-11-abc\\run\\m06\\format.json",
      "sha256": "38d264c7e6d532ef3ec8f7460b6c25abe654b06a6faf4218856583e0e128d7c8",
      "length": 1404,
      "schema_version": "0.1",
      "status": "empty"
    },
    "M07": {
      "path": "data\\acceptance\\frozen-20260910\\full-chain\\m07\\protocols.json",
      "sha256": "d38700eaa02e2e1b48ec75d900af5379de38c23b5f6ceb19a38c18a22b6d48cf",
      "length": 2219,
      "schema_version": "0.1",
      "status": "ok"
    },
    "M08": {
      "path": "reports\\acceptance\\2026-09-11-abc\\run\\m08\\0000\\recovery.json",
      "sha256": "7d46bd608aec11b2d0c6c222b175073607c7cddfeb7a1eb756d6dc175e2783fb",
      "length": 3117,
      "schema_version": "0.1",
      "status": "ok"
    },
    "M09": {
      "path": "reports\\acceptance\\2026-09-11-abc\\run\\m09\\flow_features.json",
      "sha256": "566e1cfb2ae26b4f945ec02806b9c96b27cfe03df5723a1cacc646a1fecd1b1e",
      "length": 3285,
      "schema_version": "0.1",
      "status": "ok"
    },
    "M10": {
      "path": "reports\\acceptance\\2026-09-11-abc\\run\\m10\\behaviors.json",
      "sha256": "eb531240a35efd29f416d7b5588cb0b2c478140380ccc768b0c7165c8ed8facc",
      "length": 1632,
      "schema_version": "0.1",
      "status": "ok"
    },
    "M11": {
      "path": "data\\acceptance\\frozen-20260910\\classification\\m11-v0.2\\run\\classification.json",
      "sha256": "5f18af38d0af3700ee61d16d93d5f24733fa371d2163e92a488c984cb660f7ad",
      "length": 7660,
      "schema_version": "0.1",
      "status": "ok"
    }
  },
  "deterministic_report": {
    "manifest": {
      "path": "reports\\acceptance\\2026-09-11-abc\\run\\m12\\report_manifest.json",
      "sha256": "e40e30753a7005eb34054e8c7cb95be84774e6c602673e6211011d9276b8bb42",
      "length": 5007
    },
    "status": "complete",
    "generation_mode": "deterministic"
  },
  "recovery": {
    "status": "matched",
    "recovery_id": "m08-215ff970eee6-0000",
    "expected_sha256": "215ff970eee6a68f5e5a27bef8bea4026824a1e45d2c6024e79812617dee7c07",
    "recovered": {
      "path": "reports\\acceptance\\2026-09-11-abc\\run\\m08\\0000\\recovered\\m08-215ff970eee6-0000.bin",
      "sha256": "215ff970eee6a68f5e5a27bef8bea4026824a1e45d2c6024e79812617dee7c07",
      "length": 101
    },
    "truth": {
      "path": "data\\acceptance\\frozen-20260910\\truth\\download-01.json",
      "sha256": "52d7081a5e6afa999cb40495def4309c5894f929105503dc22a6e2f51f028a11",
      "length": 222
    }
  },
  "classification": {
    "evaluation": {
      "path": "data\\acceptance\\frozen-20260910\\classification\\m11-v0.2\\run\\classification.json",
      "sha256": "5f18af38d0af3700ee61d16d93d5f24733fa371d2163e92a488c984cb660f7ad",
      "length": 7660
    },
    "prediction": {
      "path": "reports\\acceptance\\2026-09-11-abc\\run\\m11\\prediction.json",
      "sha256": "64811820e53776def7d6e1ad36a75ba14935350ec21fecf1685277b7629f4086",
      "length": 958
    },
    "model": {
      "path": "data\\acceptance\\frozen-20260910\\classification\\m11-v0.2\\run\\model.joblib",
      "sha256": "80220e1d05a9e6cacd6134e612bdbb09477e3fb83cc5cf29d6f2ed7ab4112836",
      "length": 87041
    },
    "test_macro_f1": 1.0,
    "validation_macro_f1": null
  },
  "model": {
    "status": "invoked",
    "model": "deepseek-v4-flash",
    "request": {
      "path": "data\\acceptance\\frozen-20260910\\integration\\api-run\\model\\request.json",
      "sha256": "51add36c7deee9545e29d76918ec1a6a77be7f93a5ce5869cb6c9a732ac9ac7a"
    },
    "response": {
      "path": "data\\acceptance\\frozen-20260910\\integration\\api-run\\model\\response.json",
      "sha256": "a102473647141e4e7a372944d15c5d2285e3410ff8e5122e4afc623c853587cc"
    },
    "claims": [
      {
        "text": "The input was a pcapng file of 1844 bytes and was processed with status ok.",
        "evidence_ids": [
          "evidence-m01-33abe24df5cbad28"
        ]
      },
      {
        "text": "Flow download-01-d8f9c37a5714-tcp-flow-0 contained 13 packets totaling 1076 bytes over a duration of 0.0106697 seconds.",
        "evidence_ids": [
          "evidence-m09-2c7a111907a1d04b"
        ]
      }
    ],
    "usage": {
      "prompt_tokens": 228,
      "completion_tokens": 109,
      "total_tokens": 337,
      "prompt_tokens_details": {
        "cached_tokens": 0
      },
      "prompt_cache_hit_tokens": 0,
      "prompt_cache_miss_tokens": 228
    },
    "limitations": [
      "Model claims are bounded to cited deterministic evidence."
    ],
    "manifest": {
      "path": "data\\acceptance\\frozen-20260910\\integration\\api-run\\model\\model_manifest.json",
      "sha256": "2a2213548e5b68a097a9836c46d012d6849f18f01954b434a67a8425d30152f9",
      "length": 1223
    }
  },
  "limitations": [
    "M01 and M07 are verified frozen TShark artifacts because this portable host has no TShark installation.",
    "The M03 fixed boundary is protocol-declared from the extracted HTTP body and is not presented as automatic unknown-format discovery.",
    "The controlled 18-capture classifier result is not a broad traffic-generalization claim.",
    "The persisted model call is replayed and hash-verified; this assembly does not make a second paid API call.",
    "Classifier metrics come from a small controlled loopback capture set and are not a broad generalization claim."
  ]
}
